{
  "schemaVersion": "cotsel.release-manifest.v1",
  "status": "candidate",
  "owner": {
    "role": "Integration Lead"
  },
  "cotselCommitSource": "workflow_sha",
  "repositories": [
    {
      "name": "agroasys-backend",
      "repository": "Agroasys/agroasys-backend",
      "ref": "develop",
      "commit": "7f5ed9201d56f969c39747134d0a2af8961775fb"
    },
    {
      "name": "platform.v1",
      "repository": "Agroasys/platform.v1",
      "ref": "main",
      "commit": "173463c79b4cade4466489e74b8edca47aea8d26"
    },
    {
      "name": "Cotsel-Dash",
      "repository": "Agroasys/Cotsel.dash",
      "ref": "codex/wp1-scoped-unpause-sdk-v2",
      "commit": "a03d03c8f2cc5804075137f6bfcaa6549812cd3b"
    }
  ],
  "contracts": {
    "settlementCallback": "cotsel.settlement-callback.v1",
    "observedAmounts": "cotsel.settlement-observed-amounts.v1"
  }
}
